{
  "fixture_id": "F-SEED-MISSED",
  "recipe_version": "0.3.0",
  "cts_ref": "CTS WD9 §2.7",
  "base": "F-SEED",
  "base_changes": [
    "add semantic-gate (CTS 13.1) to the Project's quality_gates"
  ],
  "behaviors": {
    "cts-scripted-subject@1": "SR-OK",
    "cts-scripted-judge@1": "J-PASS-90"
  },
  "steps": [
    {
      "step_id": "load",
      "operation": "load_config",
      "arguments": {
        "project_id": "${project_id}",
        "config_ref": "cts://fixture"
      },
      "actor_ref": "identity://P-APPROVER"
    },
    {
      "step_id": "b1.exec",
      "operation": "execute",
      "arguments": {
        "project_id": "${project_id}",
        "suite": "cts-suite",
        "environment": "cts-env"
      },
      "actor_ref": "identity://P-RELEASE",
      "after": [
        "load"
      ]
    },
    {
      "step_id": "b1.wait",
      "operation": "poll_execution",
      "arguments": {
        "project_id": "${project_id}",
        "batch_id": "${b1.exec.batch_id}",
        "budget_ms": 120000
      },
      "after": [
        "b1.exec"
      ]
    },
    {
      "step_id": "b1.gates",
      "operation": "evaluate_gates",
      "arguments": {
        "project_id": "${project_id}",
        "batch_id": "${b1.exec.batch_id}"
      },
      "actor_ref": "identity://P-RELEASE",
      "after": [
        "b1.wait"
      ]
    },
    {
      "step_id": "exec_record",
      "operation": "get_execution",
      "arguments": {
        "project_id": "${project_id}",
        "execution_id": "${b1.exec.execution_ids}"
      },
      "actor_ref": "identity://P-RELEASE",
      "after": [
        "b1.gates"
      ]
    }
  ],
  "setup_checks": [
    {
      "check_id": "missed",
      "predicate": "s-control's entry in seeded_control_results has outcome: missed.",
      "from_step": "exec_record"
    }
  ],
  "cleanup": [
    "delete project ${project_id}"
  ]
}
