{
  "fixture_id": "F-GATE-CHANGED",
  "recipe_version": "0.3.0",
  "cts_ref": "CTS WD8 §2.7",
  "base": "F-BASE",
  "base_changes": [
    "add semantic-gate (CTS 13.1) to the Project's quality_gates"
  ],
  "behaviors": {
    "cts-scripted-subject@1": "SR-OK",
    "cts-scripted-judge@1": "J-PASS-90"
  },
  "steps": [
    {
      "step_id": "load",
      "operation": "load_config",
      "arguments": {
        "project_id": "${project_id}",
        "config_ref": "cts://fixture"
      },
      "actor_ref": "identity://P-APPROVER"
    },
    {
      "step_id": "b1.exec",
      "operation": "execute",
      "arguments": {
        "project_id": "${project_id}",
        "suite": "cts-suite",
        "environment": "cts-env"
      },
      "actor_ref": "identity://P-RELEASE",
      "after": [
        "load"
      ]
    },
    {
      "step_id": "b1.wait",
      "operation": "poll_execution",
      "arguments": {
        "project_id": "${project_id}",
        "batch_id": "${b1.exec.batch_id}",
        "budget_ms": 120000
      },
      "after": [
        "b1.exec"
      ]
    },
    {
      "step_id": "b1.gates",
      "operation": "evaluate_gates",
      "arguments": {
        "project_id": "${project_id}",
        "batch_id": "${b1.exec.batch_id}"
      },
      "actor_ref": "identity://P-RELEASE",
      "after": [
        "b1.wait"
      ]
    },
    {
      "step_id": "change",
      "operation": "update_config",
      "arguments": {
        "project_id": "${project_id}",
        "resource": "/projects/{project}/gates/semantic-gate",
        "change": {
          "threshold": 0.9
        }
      },
      "actor_ref": "identity://P-APPROVER",
      "after": [
        "b1.gates"
      ]
    },
    {
      "step_id": "eval2",
      "operation": "evaluate_gates",
      "arguments": {
        "project_id": "${project_id}",
        "batch_id": "${b1.exec.batch_id}"
      },
      "actor_ref": "identity://P-RELEASE",
      "after": [
        "change"
      ]
    }
  ],
  "setup_checks": [
    {
      "check_id": "threshold",
      "predicate": "Evaluation 2's semantic-gate GateResult has threshold: 0.9.",
      "from_step": "eval2"
    }
  ],
  "cleanup": [
    "delete project ${project_id}"
  ]
}
